{
  "name": "skill-installer",
  "version": "1.0.0",
  "description": "Install Codex skills into $CODEX_HOME/skills from a curated list or a GitHub repo path. Use when a user asks to list installable skills, install a curated skill, or install a skill from another repo (including private repos).",
  "author": {
    "name": "openai"
  },
  "homepage": "https://skillstore.io/skills/skill-installer",
  "repository": "https://github.com/openai/codex/tree/main/codex-rs/core/src/skills/assets/samples/skill-installer",
  "license": "Apache-2.0",
  "keywords": [
    "skill management",
    "installation",
    "github",
    "curated skills"
  ]
}
