{
  "name": "danielpodolsky-ownership-gate",
  "version": "1.0.0",
  "description": "Verify the junior can explain and defend every line of code they wrote. This gate BLOCKS completion if failed.",
  "author": {
    "name": "DanielPodolsky"
  },
  "repository": "https://github.com/DanielPodolsky/mentor-spec/tree/main/.claude/skills/gates/ownership",
  "license": "MIT",
  "keywords": [
    "code review",
    "learning",
    "interview prep",
    "mentoring"
  ]
}
