{
  "name": "cjharmath-react-async-patterns",
  "version": "1.0.0",
  "description": "Async/await correctness in React with Zustand. Use when debugging race conditions, missing awaits, floating promises, or async timing issues. Works for both React web and React Native.",
  "author": {
    "name": "CJHarmath"
  },
  "repository": "https://github.com/CJHarmath/claude-agents-skills/tree/main/skills/react-async-patterns",
  "license": "MIT",
  "keywords": [
    "React",
    "async",
    "Zustand",
    "TypeScript",
    "debugging"
  ]
}
