{
  "name": "asmayaseen-tool-design",
  "version": "1.0.0",
  "description": "Design tools that agents can use effectively. Use when creating new tools for agents, debugging tool-related failures, or optimizing existing tool sets.",
  "author": {
    "name": "Asmayaseen"
  },
  "repository": "https://github.com/Asmayaseen/hackathon-2/tree/main/.claude/skills/tool-design",
  "license": "MIT",
  "keywords": [
    "tool-design",
    "agent-systems",
    "context-engineering",
    "api-design",
    "mcp"
  ]
}
