{
  "name": "bossjones-sqlalchemy-2-0",
  "version": "1.0.0",
  "description": "Modern async ORM with type-safe models and efficient queries",
  "author": {
    "name": "bossjones"
  },
  "repository": "https://github.com/bossjones/logging-lab/tree/main/.claude/skills/sqlalchemy",
  "license": "MIT",
  "keywords": [
    "database",
    "orm",
    "async",
    "sql",
    "backend"
  ]
}
