{
  "name": "muratcankoylan-context-degradation",
  "version": "1.0.0",
  "description": "This skill should be used when the user asks to \"diagnose context problems\", \"fix lost-in-middle issues\", \"debug agent failures\", \"understand context poisoning\", or mentions context degradation, attention patterns, context clash, context confusion, or agent performance degradation. Provides patterns for recognizing and mitigating context failures.",
  "author": {
    "name": "muratcankoylan"
  },
  "homepage": "https://skillstore.io/skills/muratcankoylan-context-degradation",
  "repository": "https://github.com/muratcankoylan/Agent-Skills-for-Context-Engineering/tree/main/skills/context-degradation",
  "license": "MIT",
  "keywords": [
    "context-degradation",
    "ai-debugging",
    "attention-patterns",
    "context-poisoning",
    "lost-in-middle"
  ]
}
