{
  "name": "clementwalter-1password-credential-lookup",
  "version": "2.0.0",
  "description": "This skill should be used when agents need to log into websites, retrieve passwords, or access credentials. CRITICAL - always use find_credential with the website URL, never guess item names.",
  "author": {
    "name": "ClementWalter"
  },
  "repository": "https://github.com/ClementWalter/rookie-marketplace/tree/main/1password-mcp/skills/credential-lookup",
  "license": "MIT",
  "keywords": [
    "credentials",
    "1password",
    "authentication",
    "password-manager"
  ]
}
