{
  "name": "atman36-quality-gates",
  "version": "1.0.0",
  "description": "Run comprehensive quality checks including linting, type checking, tests, and security audits before commits or deployments",
  "author": {
    "name": "AI-Vibe-Prompts"
  },
  "repository": "https://github.com/Atman36/AI-Vibe-Prompts/tree/main/.claude/skills/core/quality-gates",
  "license": "MIT",
  "keywords": [
    "quality",
    "testing",
    "linting",
    "security",
    "ci-cd"
  ]
}
