{
  "name": "obra-executing-plans",
  "version": "1.0.0",
  "description": "Use when you have a written implementation plan to execute in a separate session with review checkpoints",
  "author": {
    "name": "obra"
  },
  "homepage": "https://skillstore.io/skills/obra-executing-plans",
  "repository": "https://github.com/obra/superpowers/tree/main/skills/executing-plans",
  "license": "MIT",
  "keywords": [
    "planning",
    "batch-execution",
    "code-review",
    "workflow"
  ]
}
