{
  "name": "davila7-pubmed-database",
  "version": "1.0.0",
  "description": "Direct REST API access to PubMed. Advanced Boolean/MeSH queries, E-utilities API, batch processing, citation management. For Python workflows, prefer biopython (Bio.Entrez). Use this for direct HTTP/REST work or custom API implementations.",
  "author": {
    "name": "davila7"
  },
  "repository": "https://github.com/davila7/claude-code-templates/tree/main/cli-tool/components/skills/scientific/pubmed-database",
  "license": "MIT",
  "keywords": [
    "pubmed",
    "biomedical",
    "literature-search",
    "e-utilities",
    "api"
  ]
}
