{
  "name": "abdulsamad94-research-fact-checker",
  "version": "1.0.0",
  "description": "Assists authors in researching topics, verifying facts, and ensuring accuracy in their writing. Particularly useful for historical fiction, non-fiction, science fiction, and any genre requiring real-world accuracy. Use when the user needs help with research or fact-checking.",
  "author": {
    "name": "AbdulSamad94"
  },
  "repository": "https://github.com/AbdulSamad94/30-Day-AIDD-Challenge-Task-1/tree/master/Task_09/.claude/skills/research-fact-checker",
  "license": "MIT",
  "keywords": [
    "writing",
    "research",
    "fact-checking",
    "historical fiction",
    "accuracy"
  ]
}
