{
  "name": "davila7-senior-data-scientist",
  "version": "1.0.0",
  "description": "World-class data science skill for statistical modeling, experimentation, causal inference, and advanced analytics. Expertise in Python (NumPy, Pandas, Scikit-learn), R, SQL, statistical methods, A/B testing, time series, and business intelligence. Includes experiment design, feature engineering, model evaluation, and stakeholder communication. Use when designing experiments, building predictive models, performing causal analysis, or driving data-driven decisions.",
  "author": {
    "name": "davila7"
  },
  "repository": "https://github.com/davila7/claude-code-templates/tree/main/cli-tool/components/skills/development/senior-data-scientist",
  "license": "MIT",
  "keywords": [
    "machine-learning",
    "statistics",
    "data-analysis",
    "experimentation",
    "python"
  ]
}
