{
  "name": "bfdcampos-pr-description",
  "version": "1.0.0",
  "description": "Guide for creating comprehensive PR descriptions with proper structure, diagrams, and documentation for code reviews.",
  "author": {
    "name": "BfdCampos"
  },
  "repository": "https://github.com/BfdCampos/dotfiles/tree/main/claude/skills/pr-description",
  "license": "MIT",
  "keywords": [
    "pull-request",
    "documentation",
    "code-review",
    "git",
    "workflow"
  ]
}
