{
  "name": "crazyswami-wp-orchestrator",
  "version": "1.0.0",
  "description": "Master WordPress project orchestrator - coordinates all WordPress skills for complete site setup, audit, and optimization. Use for new project setup, site audits, or comprehensive reviews. Runs interview phases and manages todo lists.",
  "author": {
    "name": "CrazySwami"
  },
  "repository": "https://github.com/CrazySwami/wordpress-dev-skills/tree/main/skills/wp-orchestrator",
  "license": "MIT",
  "keywords": [
    "wordpress",
    "orchestration",
    "workflow",
    "cms",
    "automation"
  ]
}
