{
  "name": "K-Dense-AI-scvi-tools",
  "version": "1.0.0",
  "description": "This skill should be used when working with single-cell omics data analysis using scvi-tools, including scRNA-seq, scATAC-seq, CITE-seq, spatial transcriptomics, and other single-cell modalities. Use this skill for probabilistic modeling, batch correction, dimensionality reduction, differential expression, cell type annotation, multimodal integration, and spatial analysis tasks.",
  "author": {
    "name": "K-Dense Inc."
  },
  "homepage": "https://skillstore.io/skills/K-Dense-AI-scvi-tools",
  "repository": "https://github.com/K-Dense-AI/claude-scientific-skills/tree/main/scientific-skills/scvi-tools",
  "license": "BSD-3-Clause license",
  "keywords": [
    "single-cell",
    "scvi-tools",
    "omics",
    "probabilistic-modeling",
    "spatial"
  ]
}