{
  "name": "acurioustractor-design-component",
  "version": "1.0.0",
  "description": "Design Component skill for Empathy Ledger. Use for storyteller cards, story cards, profile displays, and any UI component requiring cultural sensitivity. Provides data mapping, AI enrichment patterns, and design system guidelines.",
  "author": {
    "name": "Acurioustractor"
  },
  "repository": "https://github.com/Acurioustractor/empathy-ledger-v2/tree/main/.claude/skills/local/design-component",
  "license": "MIT",
  "keywords": [
    "UI components",
    "design system",
    "cultural sensitivity",
    "storyteller cards",
    "AI enrichment"
  ]
}
