{
  "name": "davila7-linear",
  "version": "1.0.0",
  "description": "Manage issues, projects & team workflows in Linear. Use when the user wants to read, create or updates tickets in Linear.",
  "author": {
    "name": "davila7"
  },
  "repository": "https://github.com/davila7/claude-code-templates/tree/main/cli-tool/components/skills/productivity/linear",
  "license": "MIT",
  "keywords": [
    "project-management",
    "issue-tracking",
    "workflows",
    "sprint-planning"
  ]
}
