{
  "name": "artemisai-skill-creator",
  "version": "1.0.0",
  "description": "Guide for creating effective skills. This skill should be used when users want to create a new skill (or update an existing skill) that extends Claude's capabilities with specialized knowledge, workflows, or tool integrations.",
  "author": {
    "name": "ArtemisAI"
  },
  "repository": "https://github.com/ArtemisAI/code-execution-with-MCP/tree/main/skills/skill-creator",
  "license": "Complete terms in LICENSE.txt",
  "keywords": [
    "skill-development",
    "templates",
    "workflows",
    "automation"
  ]
}
