{
  "name": "ancplua-autonomous-ci",
  "version": "1.0.0",
  "description": "Ensures Claude verifies both local tests AND remote CI before claiming completion. Use BEFORE any completion claims, commits, or pull requests. Mandatory verification with evidence.",
  "author": {
    "name": "ANcpLua"
  },
  "repository": "https://github.com/ANcpLua/ancplua-claude-plugins/tree/main/plugins/autonomous-ci/skills/autonomous-ci",
  "license": "MIT",
  "keywords": [
    "ci-cd",
    "verification",
    "testing",
    "quality-assurance",
    "workflow"
  ]
}
