{
  "name": "k-dense-ai-research-grants",
  "version": "1.0.0",
  "description": "Write competitive research proposals for NSF, NIH, DOE, DARPA, and Taiwan NSTC. Agency-specific formatting, review criteria, budget preparation, broader impacts, significance statements, innovation narratives, and compliance with submission requirements.",
  "author": {
    "name": "K-Dense-AI"
  },
  "repository": "https://github.com/K-Dense-AI/claude-scientific-skills/tree/main/scientific-skills/research-grants",
  "license": "MIT license",
  "keywords": [
    "grant-writing",
    "research-funding",
    "academic-writing",
    "nsf",
    "nih"
  ]
}
