{
  "name": "openmule-mulerouter",
  "version": "1.0.0",
  "description": "Generates images and videos using MuleRouter or MuleRun multimodal APIs. Text-to-Image, Image-to-Image, Text-to-Video, Image-to-Video, video editing (VACE, keyframe interpolation). Use when the user wants to generate, edit, or transform images and videos using AI models like Wan2.6 or Nano Banana.",
  "author": {
    "name": "openmule"
  },
  "repository": "https://github.com/openmule/mulerouter-skills/tree/main/skills/mulerouter-skills",
  "license": "MIT",
  "keywords": [
    "ai",
    "media-generation",
    "video-editing",
    "image-generation"
  ]
}
