{
  "name": "bodhisearch-bodhi-sdk-react-integration",
  "version": "1.0.0",
  "description": "Integrate React+Vite web apps with bodhi-js-sdk for local LLM integration. Use when user asks to: \"integrate bodhi\", \"add bodhi sdk\", \"connect to bodhi\", \"setup bodhi provider\", \"bodhi react integration\", \"deploy bodhi to github pages\", or troubleshoot bodhi-js-sdk connection/auth issues.\n",
  "author": {
    "name": "BodhiSearch"
  },
  "repository": "https://github.com/BodhiSearch/bodhi-js/tree/main/bodhi-js-sdk/skills/react-integration",
  "license": "MIT",
  "keywords": [
    "react",
    "vite",
    "llm",
    "local-ai",
    "chat"
  ]
}
