{
  "name": "k-dense-ai-research-lookup",
  "version": "1.0.0",
  "description": "Look up current research information using Perplexity Sonar Pro Search or Sonar Reasoning Pro models through OpenRouter. Automatically selects the best model based on query complexity. Search academic papers, recent studies, technical documentation, and general research information with citations.",
  "author": {
    "name": "K-Dense-AI"
  },
  "repository": "https://github.com/K-Dense-AI/claude-scientific-skills/tree/main/scientific-skills/research-lookup",
  "license": "MIT license",
  "keywords": [
    "academic",
    "literature",
    "citations",
    "scientific",
    "papers"
  ]
}
